{
  "name": "NexusUltra-Large",
  "description": "General-purpose foundation model trained on massive corpus with high reasoning capacity.",
  "roles": ["gpai_provider", "provider"],
  "purpose": "Multimodal text and reasoning generation",
  "sector": "AI-Research",
  "placing_on_market_date": "2026-02-09",
  "is_gpai_model": true,
  "training_flops": 2e25
}
