{
  "name": "Musterversicherung term-life pricing model",
  "description": "A synthetic German life insurer's in-house gradient-boosted model that sets term-life premiums from applicant health questionnaires. The insurer builds the model and uses it in its own underwriting.",
  "roles": ["provider", "deployer"],
  "purpose": "Risk assessment and pricing of term-life insurance for natural persons",
  "sector": "Life insurance",
  "annex_iii_area": "III.5.c",
  "derogation": {
    "performs_profiling": true
  }
}
