{
  "name": "NexusLite-13B",
  "description": "General-purpose foundation model for lightweight NLP classification tasks.",
  "roles": ["gpai_provider", "provider"],
  "purpose": "Text classification and sentiment analysis",
  "sector": "AI-Analytics",
  "placing_on_market_date": "2025-11-03",
  "is_gpai_model": true,
  "training_flops": 1e24
}
